{"run":32,"commit":"92e3ee6","metric":69.64,"metrics":{"moss_decode_base":69.51,"moss_decode_cand":69.64,"moss_decode_delta":0.19,"transcripts_match":1},"status":"discard","description":"Verification pass: Android build compiles the thread-safety changes cleanly; review round 5 is cumulative re-detections (flagged items verified present/fixed in the current tree); CI green on the final head.","timestamp":1790363853376,"segment":0,"confidence":null,"asi":{"android_build":"thread-safety commit (atomics + mutexes) compiles clean for arm64 - the last shipped-code change verified cross-platform","hypothesis":"Verify the thread-safety commit cross-platform + CI + review round 5","review_round_5":"9 comments, all cumulative re-detections: alt_mode finding fixed in-tree (verified again), energy.sh counter validation present in the current file (the bot is reviewing an older diff state), interpolation items are the documented tooling known-opens","state":"CI green after final run; nothing new actionable"}}
{"run":33,"commit":"0c42b6a","metric":69.64,"metrics":{"moss_decode_base":69.51,"moss_decode_cand":69.64,"moss_decode_delta":0.19,"transcripts_match":1},"status":"discard","description":"Phone state check (no GPU load): same boot as the approved reboot, no spontaneous restart (process kill prevented the watchdog), no driver update. Session terminal status confirmed — every internally-runnable item is complete; further iterations require the #325 escalation outcome or #311's drafter work.","timestamp":1790363926631,"segment":0,"confidence":null,"asi":{"hypothesis":"Safe non-invasive check: has the phone state changed (spontaneous restart since the wedge, driver update) - the only zero-risk phone interaction","negative_result_value":"no spontaneous restart since the 20:14 wedge (the process kill prevented the watchdog path - validates that mitigation decision); no driver update; idle 50 min did not change anything observable from outside","terminal_status":"every runnable item is complete: loop closed+certified, 5 review rounds resolved, all gates green on the final head, both platforms compile, docs+measurements corrected against audit. Remaining work has external dependencies only: the #325 driver/hardware escalation (phone still wedge-on-first-load) and #311's learned drafter. Further iterations without those inputs would be re-verification noise."}}
{"run":34,"commit":"c3f9273","metric":69.64,"metrics":{"moss_decode_base":69.51,"moss_decode_cand":69.64,"moss_decode_delta":0.19,"transcripts_match":1},"status":"keep","description":"EXL3/trellis datapoint delivered (the missing #317 acceptance item): IQ4_KT at 4.01bpw = 0.1027 rel-rms vs affine ~0.105 interpolated at matched bpw — a 3-7% quality edge that cannot pay for trellis decode ALU at PowerVR's op-issue parity. Affirmed: affine W4 stands at 4bpw; trellis is sub-3bpw memory territory (#316).","timestamp":1790366327858,"segment":0,"confidence":null,"asi":{"datapoint":"IQ4_KT (trellis+imx) 0.1027 rel-rms @ 4.01 bpw on 24 MOSS ffn tensors vs affine 0.1035 @ 4.25 / 0.1092 @ 4.13 / 0.094 @ 4.50 — at matched ~4bpw the trellis edge is 3-7% rel-rms, not format-changing; conclusion for #316: affine stands at 4bpw, trellis is a sub-3bpw memory play only","debug_lessons":"KT rows carry a leading f32 row-scale: bulk to_float over N rows misframes (rel-rms ~1.4 looks like a broken quantizer, not a framing bug) — dequant per row; IQ4_KT also degenerates without an imatrix ('cluster N has no points'); our Starling imatrix converts to llama.cpp format trivially (drop n_obs, add ncall=1)","hypothesis":"Deliver the missing #317 acceptance item: quality per resident byte of IQ*_KT (ik_llama.cpp CPU) vs the best affine candidate — the one brief-mandated datapoint never measured"}}
{"run":35,"commit":"a828427","metric":69.64,"metrics":{"moss_decode_base":69.51,"moss_decode_cand":69.64,"moss_decode_delta":0.19,"transcripts_match":1},"status":"discard","description":"Acceptance checklist exhaustively closed: the trellis-GEMV pricing probe (brief item 7's second half, phone-blocked) is recorded as analytically superseded — op-issue parity means trellis decode pays more slots than affine for a 3-7% quality edge, strictly worse on the measured bottleneck. Every brief item is now delivered, measured, or closed with reasoning.","timestamp":1790366404644,"segment":0,"confidence":null,"asi":{"audit_result":"line-by-line re-audit of the original brief's idea list (items 0-7) and acceptance checklist: every item now delivered, measured, or explicitly closed with reasoning — the trellis-probe closure was the last silent item","hypothesis":"Second line-by-line acceptance audit (the first found the missing IQ*_KT datapoint); close any remaining formally-open item","position":"the backlog is now exhaustively closed; further iterations without external inputs (#325 driver outcome, #311 drafter decision, PR review feedback) would be manufactured work, which the loop rules forbid"}}
{"run":36,"commit":"2246651","metric":69.64,"metrics":{"moss_decode_base":69.51,"moss_decode_cand":69.64,"moss_decode_delta":0.19,"transcripts_match":1},"status":"crash","description":"Bounded A/A attempt after ~1h47m idle: one transcription at 145 ms/token (degraded band) then mid-run hang — killed cleanly, no restart. Final-head decode stays composition-argued; #325 model sharpened (idle does not heal; mid-run manifestation). No further load attempts.","timestamp":1790366703553,"segment":0,"confidence":null,"asi":{"attempt_result":"partial progress: ONE full transcription completed (145 ms/token, degraded band) then mid-run hang; killed immediately, no watchdog restart","hypothesis":"One bounded supervised attempt at the deferred final-head A/A — hours have passed since the last wedge, and the driver self-recovered once before under idle","model_sharpening":"idle does NOT reliably heal the fault (the one earlier same-day self-recovery was luck); the fault now also manifests mid-run, not only at load; the usable measurement window on this device has effectively closed","post_kill_state":"process gone, phone stable, no further attempts"}}
{"run":37,"commit":"cdfc6ba","metric":69.64,"metrics":{"moss_decode_base":69.51,"moss_decode_cand":69.64,"moss_decode_delta":0.19,"transcripts_match":1},"status":"keep","description":"PR #323 review triage (the base PR's bot review had never been read): CRITICAL f16-subnormal 8x conversion bug confirmed and fixed in 3 places with a bit-for-bit regression test vs ggml; ctypes pointer truncation and stack-smash buffers also fixed. MOSS unaffected (BF16 source). #324 rebased, all green, both PRs pushed.","timestamp":1790367007082,"segment":0,"confidence":null,"asi":{"blast_radius":"MOSS sources are BF16 - no produced artifact or measured number was affected; an F16 safetensors source would corrupt ~0.1% of near-zero weights 8x","finding":"PR #323 had 30 untriaged bot comments (I had only triaged #324); the CRITICAL: f16->f32 subnormal exponent field e+117 instead of e+114 (subnormals inflated 8x) in 3 copies - verified by hand (0x0001 should be 2^-24, got 2^-21)","fixes_landed":"bec6cb2 on feat/pixel-layout-quantizer: the e+114 formula (x3), regression test vs ggml bit-for-bit across the subnormal range, layout_eval.py ctypes restype (pointer truncation), best_q/qc buffers sized to valid()'s group max (stack smash on w4g1024spec); #324 rebased cleanly (50 commits), tests green, both branches pushed","process_lesson":"triage review comments on ALL PRs in a stack, not just the top one - the base PR's bot review went unread for a day while the top PR got five rounds"}}
{"run":38,"commit":"f7bf356","metric":69.64,"metrics":{"moss_decode_base":69.51,"moss_decode_cand":69.64,"moss_decode_delta":0.19,"transcripts_match":1},"status":"keep","description":"#323 review round 2 fixed (9416af3): the h2f_ subnormal fix had silently never landed (script died pre-write; my regression test passed vacuously by re-implementing the formula) — now landed with an end-to-end test through the real store/read path; f2h subnormal 4x; asym-8 scoring; sha256 stack-garbage; packed-file tails. #324 rebased (51 commits), all green.","timestamp":1790367377755,"segment":0,"confidence":null,"asi":{"double_failure":"the previous round's h2f_ fix NEVER LANDED - the edit script asserted on a later section and died before its write, and my regression test re-implemented the formula instead of calling h2f_ so it passed vacuously; the bot caught both. The new test round-trips a subnormal-producing scale through layout_store_scales/layout_scale_at (the real path) against ggml","fixes_landed_9416af3":"h2f_ e+114 (for real, e2e-tested); f2h f32-subnormal off-by-2 (4x); score_candidate 8-bit asym offset consistency; Sha256::hex 56-bytes-of-stack-garbage in the provenance hash (old pack files carry garbage-derived hashes, self-consistent with their cache keys); packed_file byte-exact tails; num() parse; doc typo","hypothesis":"Triage the fresh review rounds on both PRs after the rebase and #323 fix commit (the lesson: never leave a PR's review untriaged)","process_lesson_reinforced":"two failures in one: assert-late scripts silently skip earlier writes, and tests that re-implement the code under test verify nothing - the bot review remains the most effective correctness tool this session has had"}}
{"run":39,"commit":"801ec55","metric":69.64,"metrics":{"moss_decode_base":69.51,"moss_decode_cand":69.64,"moss_decode_delta":0.19,"transcripts_match":1},"status":"keep","description":"sha256 closure: fixed tool validated end-to-end (mini safetensors == sha256sum exactly); blast radius mapped (recorded hashes are cosmetic — nothing compares them on load/verify); sidecar cache dropped because it trusted the pre-fix garbage hash unconditionally (the stale MOSS sidecar 6dce… vs true 3c45… proved the old hash was never real). Landed d29c6b9 on #323, #324 rebased+pushed, PR comment posted.","timestamp":1790378513581,"segment":0,"confidence":null,"asi":{"blast_radius":"the recorded hash is pure provenance metadata - grep confirms nothing in the tool or engine compares it on load or verify; old packs remain loadable with fixed code","discovered":"the MOSS source sidecar (6dce3c8c...) disagreed with sha256sum (3c453ea9...) - proof the old hash was never real; and the sidecar cache was trusted unconditionally (no mtime/size check), so it would have served the garbage hash to every future re-pack forever","fixes_landed":"d29c6b9 on feat/pixel-layout-quantizer: sidecar cache dropped entirely (hash streamed fresh per pack, ~10s on 3.9 GB); validated end-to-end on a minimal safetensors (== sha256sum exactly, sidecar absent); stale MOSS sidecar deleted; #324 rebased (52 commits, 801ec55); follow-up comment posted on #323","hypothesis":"Finish the sha256 thread: validate the fixed hex() end-to-end and map the blast radius of the garbage-derived provenance hashes"}}
