{"run":16,"commit":"f943a2a","metric":69.64,"metrics":{"moss_decode_base":69.51,"moss_decode_cand":69.64,"moss_decode_delta":0.19,"transcripts_match":1},"status":"discard","description":"Driver-vs-us investigation complete: our side clean on all four checks (teardown audit, valgrind 0-lost, RADV 40 cycles, phone 20 cycles with stable ION_heap reclaim); failure is a wedged-PowerVR-driver state under sustained load, predating our kernel changes. Issue #325 filed with evidence + mitigation proposals (memory-budget preflight, fatal-on-OOM, upstream report path).","timestamp":1790337034537,"segment":0,"confidence":1.1356783919597893,"asi":{"conclusion":"NOT an engine leak: teardown spec-clean, valgrind 0 bytes lost, desktop 40 cycles clean, phone 20 cycles with perfect kernel reclaim (ION_heap stable). The vkOOM is a symptom of a wedged PowerVR driver under sustained multi-hour load (heat/uptime/charging correlated), predating our kernel changes; wedge -> watchdog restart explains the user's observed restarts","hypothesis":"The load-cycle vkOOM/GPU-hang is either an engine-side leak (teardown or host heap) or a driver-side failure; separate them with teardown audit + valgrind + monitored load cycles","method_notes":"ION_heap in /proc/meminfo is the smoking-gun monitor on Tensor (DMA-BUF/GPU pool): watch it across process exits; valgrind errors in the Vulkan loader itself (uninitialised reads) are not actionable; issue #325 filed with the full evidence table","phone_repro_status":"20/20 clean today (fresh boot, discharging); the failure needs multi-hour aggravated conditions - deliberately not recreated to avoid wedging the user's phone again"}}
{"run":17,"commit":"fa3a0ca","metric":69.64,"metrics":{"moss_decode_base":69.51,"moss_decode_cand":69.64,"moss_decode_delta":0.19,"transcripts_match":1},"status":"keep","description":"#325 wedge guards landed: mark_wedged + 15-min-TTL marker (refuse fresh retries with restart guidance), memory-budget preflight where exposed, enriched fence errors. Live-validated when the wedge struck mid-A/B. Diagnosis corrected: VkResult 2 = VK_TIMEOUT (GPU hang), not OOM — every occurrence this session was a fence timeout.","timestamp":1790338797046,"segment":0,"confidence":2.627906976744134,"asi":{"code_paths":"load-time + error-path only: no decode/numerics code touched (no A/B needed - documented rationale); G1 transcript identical on phone","diagnosis_correction":"VkResult 2 is VK_TIMEOUT (positive), NOT VK_ERROR_OUT_OF_DEVICE_MEMORY (-2): every 'vkOOM' this session was a 120s fence timeout = GPU work stopped completing. Issue #325's symptom line should be read as hang, not OOM","live_validation":"the wedge fired DURING the A/B run itself: the enriched error named it correctly and mark_wedged ran; the first build had a self-deleting-marker bug (failed runs unwind through ~Context which deleted it) - fixed with !wedged_ guard; the phone self-recovered within minutes, validating the 15-min TTL (refuse during the hot window, auto-clear after)","marker_paths_verified":"desktop: fresh refuses with message, stale ignored, clean exit clears, wedged process keeps marker; phone: normal load unaffected, transcript identical"}}
{"run":18,"commit":"217e826","metric":69.64,"metrics":{"moss_decode_base":69.51,"moss_decode_cand":69.64,"moss_decode_delta":0.19,"transcripts_match":1},"status":"keep","description":"Energy deliverable measured: fast 2.42 mWh/transcription (gauge, 12 runs, idle-subtracted; matches the old power-model 2.2), ggml 15.3 gauge / 5.2 model — honest ratio stated as 2.4–6× in fast's favor depending on method. Latency 5.41 vs 7.78 s.","timestamp":1790339787708,"segment":0,"confidence":5.255813953488268,"asi":{"cross_check":"fast 2.42 mWh (gauge) vs 2.2 mWh (#12 batterystats model) - two methods agreeing; ggml gauge 15.3 vs model 5.2 - fuel gauge over-estimates under CPU load (voltage sag), so the honest ratio is '2.4-6x less energy than ggml' with method stated","deliverable":"energy per MOSS-short transcription: fast 2.42 mWh (12 runs, screen off, idle-subtracted charge-counter gauge), median wall 5.41s vs ggml 7.78s","hypothesis":"Complete the last #317 deliverable (energy per transcription) with the honest method statement the brief requires (gauge estimate, not rails)","method_statement":"battery charge counter (fuel gauge), idle-subtracted over equal-duration screen-off control, 12 transcriptions per engine - explicitly an estimate, not a rail measurement"}}
{"run":19,"commit":"48a04e0","metric":69.64,"metrics":{"moss_decode_base":69.51,"moss_decode_cand":69.64,"moss_decode_delta":0.19,"transcripts_match":1},"status":"discard","description":"Final certification: tree audited clean (all discarded scaffolding reverted, diagnostics deliberate), final-binary transcript identical on phone, decode numbers rest on the twice-verified cool-window results (thermal dependence documented). All #317 deliverables complete.","timestamp":1790358288052,"segment":0,"confidence":null,"asi":{"hypothesis":"Polish/certify iteration per the brief's stopping checklist: scaffolding audit + final-binary verification on the PR head","scaffold_audit":"W4_NOSCALE/F16-lm_head/chunk-refactor all confirmed reverted (grep-verified 0 remnants); kept-by-design: gemv_w4um + m2 micro, rows sweep, alt probe, dump hook, energy script - each documented in its commit","thermal_note":"phone hot at 45% battery after a full measurement day: transcript gate passed on the final binary, but 113 ms/token in this state vs 69.7 verified in cool windows - decode numbers are thermal-band dependent (documented); cool-window verified numbers stand as the certified results"}}
{"run":20,"commit":"daf3a1d","metric":69.64,"metrics":{"moss_decode_base":69.51,"moss_decode_cand":69.64,"moss_decode_delta":0.19,"transcripts_match":1},"status":"discard","description":"Final G4 on the PR head (clean master rebuilt): MOSS −1.3%, PK +0.9% — gate passed; RADV preflight confirmed non-blocking. Session state refreshed for future resumption. The loop is complete in every dimension.","timestamp":1790358753157,"segment":0,"confidence":null,"asi":{"g4_final":"PR head vs clean master 4276631 (rebuilt): MOSS short 1684.9 vs 1707.6 (-1.3%), PK medium 511.4 vs 506.9 (+0.9%) - gate <=10% PASSED; RADV memory-budget preflight confirmed non-blocking (no false positive with 1.6GB arena)","hypothesis":"Final gate on the exact PR-head binary: the earlier G4 predated rows=16, the F16 revert, and the wedge guards (whose preflight is ACTIVE on RADV - a false positive would have blocked loads)","session_state":"prompt.md refreshed through the final certification; loop complete - resume only with a #311 learned drafter or new hardware/driver"}}
{"run":21,"commit":"daf3a1d","metric":69.64,"metrics":{"moss_decode_base":69.51,"moss_decode_cand":69.64,"moss_decode_delta":0.19,"transcripts_match":1},"status":"crash","description":"Final-head A/A BLOCKED by driver wedge on first load — phone cold and idle (5.5h), so heat alone doesn't explain it; refined #325 model: cumulative per-boot damage, only reboot heals. Process killed, no retries (marker absent: hang is below the fence timeout inside the driver — a mode our guards structurally cannot catch).","timestamp":1790359803529,"segment":0,"confidence":null,"asi":{"blocked_measurement":"final-head cool-window A/A decode certification: wedge struck on the FIRST load (bench hung in driver do_sys_poll, no marker - the hang is below our 120s fence timeout, stuck inside the Vulkan call; guards cannot catch this mode)","hypothesis":"Cool-window A/A on the final PR head to replace the composition argument with direct data (each constituent measured on-phone, but never the assembled head in a clean window)","wedge_model_update":"NEW datapoint for #325: wedge on first load of a session on a COLD (5.5h idle, ambient), low-load phone - kills the pure heat theory. Refined model: cumulative per-boot driver damage (this boot: 20 load cycles + energy + certification + yesterday evening's runs); cold does not heal it, only reboot does. Honest certification state: final-head decode number remains composition-argued (P1-8 verified 69.2-69.7 + measured-harmless P1-6 push constants + non-decode-path guards), each component on-phone; assembled-head direct measurement requires a fresh boot and is deferred to the user's discretion - no more reboots today without asking"}}
{"run":22,"commit":"9359732","metric":69.64,"metrics":{"moss_decode_base":69.51,"moss_decode_cand":69.64,"moss_decode_delta":0.19,"transcripts_match":1},"status":"crash","description":"Iteration blocked on phone state (same degraded boot; no reboot without user consent per my commitment). Non-phone work done: PR branch integrity verified — #323 has 7 clean commits, #324 forks cleanly at 7752c5a with 32 on top. The final-head A/A runs in minutes whenever the phone is rebooted.","timestamp":1790359936640,"segment":0,"confidence":null,"asi":{"blocked_status":"phone still on the degraded boot (uptime 6:48, wedge risk on first load); final-head A/A certification remains the only outstanding measurement; per my stated commitment, rebooting the phone requires the user's explicit go-ahead","hypothesis":"Final-head cool-window A/A (the one remaining measurement) if the phone was rebooted; otherwise verify PR integrity as the useful non-phone action","integrity_check":"PR #323 (feat/pixel-layout-quantizer): 7 clean commits on master, no accidental late landings; PR #324 forks exactly at 7752c5a with 32 commits on top - both branch structures coherent for review"}}
{"run":23,"commit":"9359732","metric":69.64,"metrics":{"moss_decode_base":69.51,"moss_decode_cand":69.64,"moss_decode_delta":0.19,"transcripts_match":1},"status":"crash","description":"User-approved reboot done → fresh boot, first load wedged identically (do_sys_poll, below-API). Per-boot-damage model dead alongside the heat model; guard build ran clean earlier so binary exonerated. Remaining model: intermittent driver/hardware fault, worsening (20 clean cycles yesterday → 2 first-load wedges today); unproven battery-level correlation noted. All load attempts stopped; phone stable.","timestamp":1790360834196,"segment":0,"confidence":null,"asi":{"datapoint":"FRESH-BOOT FIRST-LOAD WEDGE: rebooted (with user go-ahead), uptime 12 min, cold, first load → same do_sys_poll hang, no marker (below-API again). This kills the per-boot-cumulative-damage model from last iteration — nothing had accumulated on this boot","hypothesis":"Reboot (user-approved via iteration request) clears the driver state → run the deferred final-head A/A certification","models_dead":"heat (cold idle strike), per-boot accumulation (fresh-boot strike), binary (guard build ran clean at 15:00 and 18:30 on the old boot). Remaining: intermittent driver/hardware fault with worsening frequency (yesterday morning: 20 clean cycles; today: 2 consecutive first-load wedges); noted-but-unproven: battery-level correlation (clean runs all >=45%, both wedges <=44%)","response":"process killed, phone stable (no watchdog restart), NO further load attempts — every attempt risks the watchdog restart the user complained about; certification stands on the composition argument; #325 gets this datapoint"}}
{"run":24,"commit":"7b20cdb","metric":69.64,"metrics":{"moss_decode_base":69.51,"moss_decode_cand":69.64,"moss_decode_delta":0.19,"transcripts_match":1},"status":"discard","description":"CI verified green on both PRs: #323 all checks pass; #324 zero failures (code-review bot completed, matching its 5 prior green runs). PR #324 title/body refreshed to the final branch state. The merge-readiness box is checked.","timestamp":1790361261272,"segment":0,"confidence":null,"asi":{"ci_323":"ALL CHECKS PASS (CPU repack x2, experiments harness, native engine guards, SONAR, Socket x2, CodeRabbit)","ci_324":"0 failures after the final code-review bot run completed (5 previous runs on this branch all green); pullfrog + CodeRabbit pass","hypothesis":"CI verification of both PRs - the merge-readiness box never checked locally-vs-CI","pr_polish":"PR #324 title/body updated to reflect the final branch contents (was written pre-P1-5: now names the rows win, gemv_w4um, energy, wedge guards, closed directions, transfer rules, budget accounting)"}}
{"run":25,"commit":"aba7b85","metric":69.64,"metrics":{"moss_decode_base":69.51,"moss_decode_cand":69.64,"moss_decode_delta":0.19,"transcripts_match":1},"status":"keep","description":"Bot-review fix round: 4 high-severity finding groups fixed (probe UB, store_pair semantics, marker scoping, tooling hardening), each verified; eval numbers unchanged (7.43% exact reproduction); review response posted on the PR with the one reasoned not-adopted item.","timestamp":1790361609560,"segment":0,"confidence":null,"asi":{"fixes_adopted":"probe parsing UB (bare m2/s tokens, sscanf returns, static m1), store_pair semantics (8-bit pair rejected by valid(), gated out of native Q8_0; 4-bit -a documented as <=1ulp rounding-order), wedge-marker scoping (alloc-OOM no marker; only writer clears), tooling hardening (sha256 base pin, G1 empty guard, metric validation, energy counter validation)","hypothesis":"Triage the bot review's high-severity findings on PR #324; fix what is real, verify no measured number changes, respond on the thread","not_adopted":"VK_TIMEOUT-should-not-wedge: the session's observed wedge IS a fence timeout (#325) - timeout keeps marking; the 15-min TTL bounds false positives from genuinely slow dispatches","verification":"fast_weights_test all green; eval spot-check reproduces 7.43% on 25 clips EXACTLY (store_pair->Q4_0 values unchanged); bare-token probes now error cleanly; w8g32sym-a rejected at parse"}}
{"run":26,"commit":"f888393","metric":69.64,"metrics":{"moss_decode_base":69.51,"moss_decode_cand":69.64,"moss_decode_delta":0.19,"transcripts_match":1},"status":"keep","description":"Review round 2: the bot's token-1 finding exposed a real missing store in gemv_w4um (silently no-op'd edit, hidden by the missing check) — fixed, both tokens verified ≤3e-3, timing unchanged, log claims corrected. Plus 9 smaller adoptions; response posted on the PR.","timestamp":1790362419054,"segment":0,"confidence":null,"asi":{"head_bug":"gemv_w4um GEMV_M token-1 store was MISSING from gemv.comp (P1-6 edit no-op'd; kernel compiled, timed right, token-0 checked clean - only the missing token-1 CHECK hid it). Fixed + verified both tokens <=3e-3; timing unchanged; no engine dispatch path existed so no shipped behavior affected; P1-6 log claim corrected","hypothesis":"Triage review round 2 (14 new comments after the fix commit)","other_fixes":"m2/altx bits!=4 rejected; m2 K%4=0; sweep rsplit print; dead condition; %d format; fopen diagnostic; wrote_marker_ after successful write; budget preflight zero-budget skip; RESEARCH_LOG corrections (budget wording, ideas.md stale levers)","process_lesson":"a correctness check that is itself never executed (tok_base dead) is indistinguishable from a passing check - the bot's dead-variable finding was the signal; unasserted python-replace edits can silently no-op (the P1-6 root cause) - future shader edits must be verified by grep before building"}}
{"run":27,"commit":"f888393","metric":69.64,"metrics":{"moss_decode_base":69.51,"moss_decode_cand":69.64,"moss_decode_delta":0.19,"transcripts_match":1},"status":"discard","description":"Post-fix verification: Android build compiles the changed gemv_w4um shader cleanly; review round 3 is stale re-detections (0 comments on the final head; flagged items already fixed in-tree); CI fully green. P1-6 timing claims stand (store-only fix, ALU-identical, rates match).","timestamp":1790362853523,"segment":0,"confidence":null,"asi":{"android_build":"gemv_w4um.spv recompiles clean for arm64 (17.6 KB) — the token-1 store shader change verified cross-platform, not just desktop RADV","hypothesis":"Post-fix verification: (a) Android build compiles the changed shader, (b) review round 3 + CI on the final head","review_round_3":"13 comments, ALL on intermediate commits (0 on f888393): stale re-detections of known-opens — the alt_mode bits-gating it flags IS in the tree, energy.sh already has export -f bench; no genuinely new actionable findings","timing_invariance":"the token-1 store fix cannot change P1-6 timing (the store was the only missing op; ALU path identical) — confirmed: post-fix 133-138 G w/s matches pre-fix 133-149"}}
{"run":28,"commit":"31b5bc2","metric":69.64,"metrics":{"moss_decode_base":69.51,"moss_decode_cand":69.64,"moss_decode_delta":0.19,"transcripts_match":1},"status":"discard","description":"Self-verification sweep (applying the session's own silent-noop lesson to its own tooling): research-log corrections confirmed present in-file despite the mid-script assertion failure; discarded-work remnants zero. Session at its fixed point.","timestamp":1790362954803,"segment":0,"confidence":null,"asi":{"hypothesis":"Verify the session's own tooling didn't eat an edit (the review round's lesson): the research-log correction script died mid-run on a failed assertion — did its earlier in-memory replacements get written?","result":"suspicion was wrong: the P1-6 correction IS in the committed file, stale claim count 0 (verified by grep); discarded-work sweep also clean — zero idot / F16-lm_head / W8IDOT remnants anywhere","session_fixed_point":"loop closed+certified, PRs green+review-hardened through 3 rounds, phone advertising but wedge-blocked for loads (per #325), no runnable hypothesis outside #311's learned-drafter work or a driver/hardware fix"}}
{"run":29,"commit":"7f623cf","metric":69.64,"metrics":{"moss_decode_base":69.51,"moss_decode_cand":69.64,"moss_decode_delta":0.19,"transcripts_match":1},"status":"keep","description":"docs/fast-engine.md updated to the landed state: rows=16 vendor pin with measured rationale, gemv_w4um two-token kernel note, #325 wedge-guard behavior (marker file, budget preflight). Also documented the stacked-PR doc-file situation (PACKED row is on #323's side of the fork).","timestamp":1790363077436,"segment":0,"confidence":null,"asi":{"docs_gap":"docs/fast-engine.md still described GEMV rows 8 (the pre-P1-8 default) and knew nothing of gemv_w4um or the wedge guards - updated with the measured rationale and pointers to the research log","hypothesis":"Documentation polish: the user-facing engine docs should reflect the landed state before review","stacked_pr_note":"the STARLING_FAST_PACKED env-table row lives on PR #323's branch (added after #324 forked) - #324's copy of the file predates it; merge #323 first, rebase #324, git resolves it; noted here so it is not mistaken for a conflict problem"}}
{"run":30,"commit":"0e75e12","metric":69.64,"metrics":{"moss_decode_base":69.51,"moss_decode_cand":69.64,"moss_decode_delta":0.19,"transcripts_match":1},"status":"keep","description":"Tooling corrections landed: energy idle subtraction now duration-scaled per window (ggml 15.3→21.9 mWh — the raw subtraction had understated ggml; conclusion strengthens to 2.2–9× in fast's favor), DO_PK failures no longer destroy MOSS metrics, RUNS doc matches code.","timestamp":1790363188350,"segment":0,"confidence":null,"asi":{"correction_impact":"the energy idle over-subtraction UNDERSTATED ggml (raw: 15.3; duration-scaled: 21.9 mWh/transcription) - the error direction was conservative for the fast engine's advantage, so the correction strengthens the conclusion: fast 2.42 mWh vs ggml 5.2-21.9 depending on method = 2.2-9x in fast's favor (was stated 2.4-6x)","hypothesis":"Land the deferred review findings in the committed tooling: energy idle-duration scaling (a real methodological flaw), DO_PK failure guard (PK failure was destroying MOSS metrics), RUNS doc drift","method_note":"idle drain rate = idle_uAh / idle_window_seconds, applied per-window; verified with the actual measured points before landing"}}
{"run":31,"commit":"92e3ee6","metric":69.64,"metrics":{"moss_decode_base":69.51,"moss_decode_cand":69.64,"moss_decode_delta":0.19,"transcripts_match":1},"status":"keep","description":"G4 re-confirmed at the final head (1726 ms median vs master band, within gate; decode surface unchanged by review fixes) and thread-safety hardening landed: atomic wedged flag, mutexed marker lifecycle, guarded dump-hook map — the last open review findings in shipped code.","timestamp":1790363375243,"segment":0,"confidence":null,"asi":{"g4_head":"final head desktop MOSS-short: 1712.7/1726.4/1893.5 ms median 1726 (G4-verified band at daf3a1d was 1670-1686 master 1634-1708) - within the gate vs master 1708 worst-case (+1.1%), the 1893 round is the known desktop variance; decode-path surface unchanged since G4 verification except the GEMV_M-only store (never dispatched)","hypothesis":"Re-close G4 at the final head (review fixes postdate the last G4 run) + land the thread-safety findings (unsynchronized wedged_ flag and dump-hook static map - theoretical UB in shipped code)","thread_safety":"wedged_ -> atomic; marker write vs destructor remove -> shared mutex; dump-hook suffix map -> mutex-guarded; behavior unchanged (tests green, transcript identical)"}}
