{"type":"config","name":"Pixel layout+kernel co-design: MOSS decode ms/token on Pixel 10 Pro (#317)","metricName":"moss_decode","metricUnit":"ms/token","bestDirection":"lower"}
{"run":1,"commit":"7752c5a","metric":68.08,"metrics":{"moss_decode_base":68.08,"moss_decode_cand":70.02},"status":"crash","description":"Baseline A/B (identical binaries): base median 68.08, cand 70.0 ms/token; one 137 outlier round (thermal/slow-mode). Round spreads: base 67.67/69.25/68.08, cand 68.99/70.02/137.62. Harness validated after phone-environment battles (screen-on compositor noise, GPU device-memory degradation across loads, adb waiter self-match hang).","timestamp":1790319238571,"segment":0,"confidence":null,"asi":{"finding":"phone GPU memory degrades across repeated 1.6GB model loads (vkWaitForFences VkResult 2 = device OOM after ~6-8 loads, worse with uptime); reboot restores; decode degrades to ~137 ms/token in slow mode under sustained load+charging","hypothesis":"Baseline: identical base/cand binaries (master+phase0, no kernel change); validate A/B harness + noise floor","measure_protocol":"screen MUST be off (compositor shares GPU: 2x swings otherwise); wait for previous bench process via pidof (pgrep -f self-matches: infinite loop); reboot before long sessions if vkOOM appears; ~6 model loads per session budget"}}
{"run":2,"commit":"84b8010","metric":75.35,"metrics":{"moss_decode_base":77.1281,"moss_decode_cand":75.35,"moss_decode_delta":-2.31,"transcripts_match":1},"status":"keep","description":"BASELINE: MOSS decode 75.35 vs base 77.13 ms/token on identical binaries (order-balanced A/B, 2 rounds × 6 runs, screen off, post-reboot). Noise floor ±2.5%; deltas <3% = noise; absolute numbers boot-dependent. Transcript gate ✓ (delta -2.31%).","timestamp":1790321996042,"segment":0,"confidence":null,"asi":{"gpu_health_budget":"~8 model loads per boot; reboot when vkOOM or bench startup hangs appear","hypothesis":"Official baseline after harness stabilization: identical binaries, balanced ordering","noise_floor":"identical binaries measure +/-2.5% between sides (75.35 vs 77.13); deltas under ~3% are noise; absolute ms/token varies per boot (68-77) - only same-window A/B counts","phone_protocol":"reboot; screen off; kill background apps; ROUNDS=2 RUNS=6; base binary pinned by commit + base_dirty marker"}}
{"run":3,"commit":"84b8010","metric":73.81,"metrics":{"moss_decode_base":73.33,"moss_decode_cand":73.81,"moss_decode_delta":0.65,"transcripts_match":1},"status":"discard","description":"int8-x W8 lm_head GEMV via dotPacked4x8EXT: correct (micro rel err 1e-3, transcripts identical) but NO speed win: real-shape isolated 42.5 vs 43.4 GB/s, end-to-end 73.81 vs 73.33 (+0.65%, noise). The op-issue ceiling applies equally to SDot; v1's manual x-quant (~8 ops/vec4) ate the savings.","timestamp":1790322964397,"segment":0,"confidence":4.720779220779242,"asi":{"bottleneck_model":"ALL vector ops (f32 FMA, SDot) share ONE ~38.5 G ops/s issue ceiling on DXT: alu probe 77.5G f32 MAC/s = idot probe 154G i8-MAC/s = 38.5G ops/s; W4 scalar ~ W8 scalar ~ 37-38 G w/s regardless of bytes -> per-weight op COUNT is the only lever; dot4 saves ops only if aux ops shrink too","expected_vs_measured":"expected ~7% (lm_head ~18% of decode, 2x kernel); measured isolated real-shape -2% (42.5 vs 43.4 GB/s), end-to-end +0.65% (noise)","hypothesis":"int8 activations on the W8 lm_head GEMV via OpSDot cut ALU per weight ~2x on the issue-bound decode","next":"v2: replace the 8-op-per-vec4 manual x-quant with packSnorm4x8 (1 op per 4 values) - the x-quant overhead (~0.14 ops/w amortized over RPP=16 rows) cancels the dot savings in v1","overheads":"per-32w budget v1: dots 0.25 + x-quant 0.14 + loads 0.1 + scale FMA 0.06 ~= scalar path; v2 target ~0.45 ops/w -> ~85 G w/s"}}
{"run":4,"commit":"47eab93","metric":73.33,"metrics":{"moss_decode_base":73.33,"moss_decode_cand":73.33,"moss_decode_delta":0,"transcripts_match":1},"status":"discard","description":"Probe session: skinny GEMM flat 7.1ms M=1..16 (6.8x GEMV — speculative needs an M-token GEMV kernel, ~1.6-1.8x op cut/token at M=4-8); f16 dots 4 MAC/slot on DXT (same as SDot, 2.6x f32 FMA). GEMV plateau ~40 G w/s is structural (latency/occupancy), not op-count.","timestamp":1790323984901,"segment":0,"confidence":7.198019801980157,"asi":{"f16_dot_rate":"phone: 377 G f16-MAC/s = 94 G dots/s = 4 MAC/slot; f32 FMA 246 G MAC/s; i8 SDot 159 G MAC/s = 4 MAC/slot - same slot efficiency as f16","gemm_skinny":"phone tiled GEMM W4 6144x2048: flat 7.1-7.3ms at M=1..16 vs GEMV 1.04ms - the M rows are free but M=1 costs 6.8x a GEMV; speculative verify needs a dedicated M-token GEMV (unpack+load amortization ~1.6-1.8x fewer ops/token at M=4-8)","gemv_plateau":"all GEMV variants (W4 scalar/W4U/W8/W8-idot/F16) land 37-46 G w/s; probe headroom 2-4x exists in dots alone -> latency/occupancy structural limit, not op count","hypothesis":"Side measurements (#311 pricing + f16-dot rate): no code-path change, pure probes"}}
{"run":5,"commit":"c26fd90","metric":73.33,"metrics":{"moss_decode_base":73.33,"moss_decode_cand":73.33,"moss_decode_delta":0,"transcripts_match":1},"status":"discard","description":"W4_NOSCALE speed probe (scale load removed, wrong numerics by design): saturated lm_head shape unchanged (25.7 vs 26.5 GB/s) — scale stream free at saturation; small N=6144 shape +28% (load-latency dominated when unsaturated). Scale-interleave layout idea: not supported.","timestamp":1790324490225,"segment":0,"confidence":15.145833333333199,"asi":{"hypothesis":"The W4U GEMV plateau (~40 G w/s) comes from the second load stream (scale arena) / load-path costs; removing the scale load prices it","learning":"phone: N=151936 rows=32 (saturated, 4748 WGs): noscale 25.7 vs baseline 26.5 GB/s - the scale stream costs NOTHING at saturation; N=6144 rows=16 (384 WGs, unsaturated): noscale 15.0 vs 10.7 GB/s (+28%) - small-N GEMVs are latency/load dominated. Dual-stream scale-interleave layout (idea #5) has no support for the saturated case; small-N overheads are real but those shapes don't saturate the GPU in isolation anyway","next":"M-token GEMV kernel (the measured lever): per 32w at M=2, unpacks shared -> ~12 ops/token vs 20 at M=1 (1.67x predicted cut); build as micro-measurable variant"}}
{"run":6,"commit":"bb7db62","metric":75.69,"metrics":{"moss_decode_base":75.5,"moss_decode_cand":75.69,"moss_decode_delta":0.25,"transcripts_match":1},"status":"keep","description":"GEMV_M two-token W4U GEMV: one weight pass, two x vectors, shared unpacks. Phone: 1.76-2.11x per-token weight rate (second token nearly free), both tokens bit-checked; end-to-end +0.25% (noise) transcripts identical. Infrastructure for #311 speculative verify — the measured lever from the skinny-GEMM pricing.","timestamp":1790325110280,"segment":0,"confidence":7.198019801980157,"asi":{"desktop":"M=2 second token FREE (4.22 vs 4.23 ms at N=151936, bandwidth-bound); 142-149 G w/s per token","hypothesis":"M-token GEMV: share the weight unpacks across M tokens - per 32w at M=2 ~12 ops/token vs 20 at M=1, so the issue-bound decode GEMV should approach 1.67x per token","next":"#311 integration: drafter (n-gram / Parakeet-partial copy) + verify recording using gemv_w4um; at acceptance >=0.5 the GEMV time per output token halves - with measured 1.8-2.1x, net decode ~0.55-0.65x","phone":"M=2 vs M=1 per-token rate: N=151936 69.7 vs 34.0 G w/s (2.05x), N=6144 34.2 vs 16.2 (2.11x), N=12288 48.7 vs 27.7 (1.76x); both tokens check rel err ~1e-3; end-to-end +0.25% (noise) with transcripts identical - the GemvArgs push-constant extension breaks nothing"}}
{"run":7,"commit":"06b097e","metric":75.69,"metrics":{"moss_decode_base":75.5,"moss_decode_cand":75.69,"moss_decode_delta":0.25,"transcripts_match":1},"status":"discard","description":"Drafter-acceptance study (12 FLEURS clips, greedy token streams): online n-gram 1.000 tokens/pass (dead — no repeats in 30-token ASR streams); Parakeet copy-draft 1.03-1.05 (dead standalone — BPE-level divergence without prompt conditioning). Self-lookahead proven zero-gain by construction. Speculative decode for the standalone metric needs a learned drafter; gemv_w4um remains the verify primitive.","timestamp":1790325566847,"segment":0,"confidence":4.720779220779242,"asi":{"copy_draft_standalone":"parakeet-text drafts vs standalone MOSS greedy: 1.033 (K=2) / 1.051 (K=3) tokens/pass - token streams diverge without prompt conditioning; casing normalization changes nothing","hypothesis":"A drafter exists that makes the M-token GEMV (gemv_w4um, 1.76-2.11x/token measured) exploitable for standalone MOSS decode: online n-gram or Parakeet copy-draft with K>=2","implication_for_311":"speculative decoding for STANDALONE moss decode needs a LEARNED drafter (EAGLE-3-class, #292's gated follow-up) or must target the product cleanup flow (Parakeet text in the MOSS prompt -> model reproduces it -> high acceptance) which is a different measurement than moss_decode. The gemv_w4um kernel stays as the verify primitive","method":"greedy streams encode every argmax (token[i+1] == argmax at position i by definition), so acceptance is simulable offline from token ids; STARLING_FAST_DUMP_TOKENS hook dumps them (kept, env-gated)","self_lookahead_proof":"single-draft self-lookahead gains ZERO by construction: the pass re-derives the pending token (identical context -> identical logits) and advances exactly one token; K>=2 real drafts are required","token_dump":"12 FLEURS en clips via desktop fast engine; ids match transcripts; parakeet texts from the same clips"}}
{"run":8,"commit":"0c10a1a","metric":69.21,"metrics":{"moss_decode_base":70.54,"moss_decode_cand":69.21,"moss_decode_delta":-1.88,"transcripts_match":1},"status":"keep","description":"PowerVR decode GEMV rows 8/32→16 (pinned, no adaptive growth/shrink): MOSS decode 70.54→69.21 ms/token (−1.88%, cand wins all 3 rounds; transcripts identical). Micro: rows=16 best-or-tied at every decode shape (qkv +15%, o +31%, down +8%); end-to-end ≈35% of isolated delta.","timestamp":1790326539334,"segment":0,"confidence":0.5794871794871763,"asi":{"hypothesis":"The adaptive gemv rows heuristic (rows=8 for small N, grow to 32 at >=384 WGs) is mistuned for MOSS decode shapes: every workgroup re-reads the whole x vector, so at rows=8 the x traffic rivals weights on small-N GEMVs; rows=16 measured best-or-tied at every real shape","in_context_translation":"end-to-end gain is ~35% of the isolated micro delta (micro barrier-per-rep overstates small-N costs) - plan on that factor for future micro->context extrapolations","micro_data":"phone W4 rows=8 vs best: qkv(N=4096) 29.9->34.5 G w/s (+15%), o(N=2048) 24.8->32.4 (+31%), gateup(N=12288) 33.5(r32)->34.9(r16) (+4%), down(N=2048,K=6144) 30.8->33.2 (+8%), lm_head 41.0(r32)=41.1(r16)","mechanism_verified":"first A/B (+0.19%) silently reverted o/down to rows=8 via the shrink-to-256-WGs rule (gemv_min_wgs); pinning min_wgs=0 on PowerVR delivered the win - the min-workgroups occupancy assumption is falsified at N=2048 (128 WGs suffice)","stopping_note":"evidence structure: complete 6/6 round separation (cand 68.7-69.9 vs base 70.2-70.9), G1 identical, causally isolated"}}
{"run":9,"commit":"d9da08e","metric":76.37,"metrics":{"moss_decode_base":69.81,"moss_decode_cand":76.37,"moss_decode_delta":9.39,"transcripts_match":0},"status":"discard","description":"F16 lm_head (opt-in): REJECTED — +9.4% decode (76.4 vs 69.8 ms/token). F16 doubles the table bytes per token (622 vs 350 MB) and in-context bandwidth is ~43 GB/s, not the micro's 90: predicted +6.4 vs measured +6.6 ms. Micro rates don't transfer for bandwidth-doubling changes. G2 had passed (7.83 vs 7.87).","timestamp":1790328193245,"segment":0,"confidence":0.601063829787233,"asi":{"bandwidth_model":"in-context the lm_head sees ~43 GB/s (W8: 350MB/token = 8.1ms matches micro 9.0); F16 needs 622MB/token = 14.5ms at that rate — the +6.4ms predicted EXACTLY matches the measured +6.6ms","hypothesis":"lm_head embed at F16 (opt-in STARLING_FAST_LM_F16): isolated micro said 45 vs 34.4 G w/s (rows=48 vs 16) -> expected -2.1ms/token","lessons":"(1) the micro's 90 GB/s for the 622MB F16 table did NOT transfer to context — isolated-kernel rates are unreliable for changes that DOUBLE the bytes moved; model in-context bandwidth at ~43 GB/s for this access pattern. (2) format-aware rows: W8 sweep at N=151936 confirmed rows=16 (34.4 vs 32.0 at rows=32) — P1-8's pin was already optimal for W8 too, no collateral. (3) the 6-chunk dequant_row refactor (needed for 5-chunk F16) works but reverts as dead infrastructure","wer_gate":"G2 passed before the speed test: fast+LM_F16 = 7.83% vs 7.87% baseline en_us 100 (the W8->F16 requant is quality-neutral)"}}
{"run":10,"commit":"22827ab","metric":69.64,"metrics":{"moss_decode_base":69.51,"moss_decode_cand":69.64,"moss_decode_delta":0.19,"transcripts_match":1},"status":"discard","description":"CLOSING VERIFICATION: identical binaries 69.64 vs 69.51 ms/token (±0.3% window noise), transcripts identical, all gates green. Loop complete per stopping rules: decode budget fully accounted, every direction closed by measurement.","timestamp":1790328619261,"segment":0,"confidence":0.533018867924525,"asi":{"final_state":"branch autoresearch/pixel-layout-2026-09-25 @ 22827ab; decode 69.6 ms/token with the P1-8 rows=16 keep (verified -1.9% same-window); budget fully accounted: linears op-bound ~41ms + lm_head ~8ms + dispatch ~5ms + attention ~4ms","gates":"G1 transcripts identical; G3 fast_weights_test all pass + STARLING_FAST=OFF builds; G4 desktop untouched (vendor-gated change); G5 parakeet 2064-2195ms identical binaries, historical band 1957-2184","hypothesis":"Closing verification (RESEARCH_LOG #23/#25/#27 pattern): certify the final committed state - A/A noise floor, all gates","loop_state":"backlog exhausted per the brief's stopping rules: every direction measured (OpSDot, f16-dot, scale-interleave, rows, F16-lm_head, drafters) and closed with data; the one quantified leftover (W4 lm_head, -1.4ms) fails the quality math (q4e4 already at +0.19pt of the +0.2 gate; runtime requant is strictly worse) and was rejected in #24"}}
{"run":11,"commit":"3b0ae38","metric":69.64,"metrics":{"moss_decode_base":69.51,"moss_decode_cand":69.64,"moss_decode_delta":0.19,"transcripts_match":1},"status":"discard","description":"Alternation probe (clean boot): spec-switch +7%, shader-switch +13-35% per iteration → ~1.6-5ms/token of the 10ms gap is pipeline switching (structural: gemv↔attn can't share a pipeline), rest is DRAM-cold vs L2-warm (physics). No actionable lever ≥1% remains; closure stands. Latent plain-micro segfault found and fixed.","timestamp":1790330131617,"segment":0,"confidence":0.47881355932203207,"asi":{"attribution":"of the ~10ms micro-vs-context gap: ~1.6-5ms pipeline switches (2 unavoidable gemv<->attn shader switches per layer at +13-35% per switched iteration + down-proj lanes=192 spec divergence at +7%), ~5-8ms DRAM-cold weights vs L2-warm micros (physics); no actionable lever >=1% remains","hypothesis":"The unexplained ~10ms/token between the isolated-kernel sum (59ms) and in-context decode (69.7ms) is pipeline-switch cost — if large, unification becomes a target","lessons":"(1) clean-boot measurement was required: the degraded-boot run (12+ loads) showed 30% low absolute rates and contradictory deltas - the protocol note about boot health applies to probes too. (2) caught a real latent bug: plain GEMV micro runs segfaulted since the P1-8 sweep refactor (dangling rec_out) - fixed and committed. (3) probe cost: alternation doubles effective kernel diversity per rep, so compare only the DELTA vs plain at the same shape/boot","switch_costs":"phone clean boot: spec-switch +7% (0.016ms), shader-switch +13-35% (0.02-0.08ms) per iteration at N 2048-4096"}}
{"run":12,"commit":"3b0ae38","metric":69.64,"metrics":{"moss_decode_base":69.51,"moss_decode_cand":69.64,"moss_decode_delta":0.19,"transcripts_match":1},"status":"crash","description":"Energy-measurement iteration BLOCKED: the phone went offline (no mDNS, no ping) before any measurement. The brief's energy-per-transcription deliverable (charge-counter gauge primary, batterystats model as stated-estimate cross-check, final state vs ggml) remains pending device return. No measurement was fabricated.","timestamp":1790330687631,"segment":0,"confidence":0.4185185185185164,"asi":{"blocked_by":"phone offline mid-iteration: no _adb-tls-connect mDNS advertisement, no ICMP to 192.168.178.59 for ~8 minutes (was healthy at the last probe boot); powered off, wifi dropped, or physically away","deliverable_pending":"energy per MOSS-short transcription for the final state vs the ggml engine, method: dumpsys battery 'Charge counter' (gauge/coulomb counter, primary) + batterystats power model (cross-check, explicitly an estimate), screen off, one bench invocation with --runs N per side (1 model load each, GPU-health budget); idle control of equal duration; report mWh/transcription with the method stated per the brief","resume":"reconnect via avahi-browse when the phone returns; the protocol needs no code changes - just the two bench invocations plus charge-counter reads"}}
{"run":13,"commit":"decb18b","metric":69.64,"metrics":{"moss_decode_base":69.51,"moss_decode_cand":69.64,"moss_decode_delta":0.19,"transcripts_match":1},"status":"discard","description":"G4 VERIFIED (clean-master baseline, fresh build): desktop RADV branch 1666 vs master 1634 ms MOSS-short (+1.9%), PK medium 482.7 vs 479.7 (+0.6%) — inside the ≤10% gate. The stale main-checkout binary (1864ms) was rejected as a baseline.","timestamp":1790331489012,"segment":0,"confidence":0.3717105263157872,"asi":{"baseline_warning":"the main checkout's build-bench-vk binary is NOT a valid baseline: its build dir contains experimental artifacts (coop_probe.spv not in master's shader list) - a fresh clean-master build (4276631 + pinned ggml e91ded11) measured 1634ms where the stale binary measured 1864ms","g4_result":"MOSS short: branch 1666 vs clean master 1634 ms (+1.9%, 3 interleaved rounds x 4 runs); Parakeet medium: 482.7 vs 479.7 ms (+0.6%) - both comfortably inside the <=10% gate; the branch's desktop-active deltas are only the GemvArgs push-constant extension (+2 words) since rows=16 and all other changes are vendor-gated or env-gated","hypothesis":"G4 gate verification for the final branch state (never formally logged this session): desktop RADV within 10% of master","phone_status":"still offline (no mDNS, no ping) - the energy deliverable remains blocked; G4 ran desktop-only as the one runnable acceptance item"}}
{"run":14,"commit":"5156b82","metric":69.64,"metrics":{"moss_decode_base":69.51,"moss_decode_cand":69.64,"moss_decode_delta":0.19,"transcripts_match":1},"status":"discard","description":"Packed-file path regression check at final branch state: STARLING_FAST_PACKED loads (394 tensors, pinned source hash) and transcribes all three fixtures correctly after the GemvArgs/rows/F16-revert changes — the #318 handoff machinery is intact. Phone reachable by ping but wireless debugging is off (needs physical re-enable); energy stays blocked.","timestamp":1790331622512,"segment":0,"confidence":0.5485436893203856,"asi":{"hypothesis":"Regression check of the packed-file path (STARLING_FAST_PACKED, the #318 handoff machinery) at the final branch state - it was verified in Phase 0 but the branch since gained the GemvArgs extension, rows=16 pin, and the F16 revert","phone_status":"phone back on WiFi (ping ok) but wireless debugging not listening: no mDNS advertisement, no open TCP port in the plausible ranges (nc scan) - needs physical re-enable; energy deliverable remains blocked","result":"packed override loads (394 tensors, 1658 MB, imatrix rounding, pinned source hash) and transcribes short/medium/long correctly at the final state (5156b82) - no regression to the #318 path"}}
{"run":15,"commit":"86b376c","metric":69.64,"metrics":{"moss_decode_base":69.51,"moss_decode_cand":69.64,"moss_decode_delta":0.19,"transcripts_match":1},"status":"discard","description":"Energy measurement iteration: landed .auto/energy.sh (gauge-primary, idle-subtracted, batterystats-model cross-check, one load per engine); reporting logic dry-run verified on synthetic data. Phone still pingable with no adb port — the measurement itself runs the moment wireless debugging is re-enabled.","timestamp":1790331724173,"segment":0,"confidence":0.7243589743589703,"asi":{"deliverable_state":"energy per transcription: script landed (.auto/energy.sh), parsing/reporting dry-run verified with synthetic gauge data; hard-blocked on the phone's wireless debugging being re-enabled (ping ok, no adb port open in any scanned range)","dry_run_output":"synthetic 12-run example computes idle-subtracted mWh/transcription for fast and ggml plus their ratio, with the method statement (gauge primary, batterystats model estimate, not a rail measurement) required by the brief","hypothesis":"Advance the one blocked deliverable (energy) as far as possible without the device: turn the queued protocol into ready-to-run infrastructure with verified host-side logic"}}
